,0,
0,   So what i found out there is a sector but actually i have had to go,noHate
1,I want a sector factory question it is impossible,noHate
2,I am delighted to report back,noHate
3,The answer is no,noHate
4,Only till half of the doll awarded have p hair,noHate
5,Customers can an extra for it i spent getting my in laser office proof,noHate
6,We are not communicate with each other,noHate
7,I want to talk with you doing with robot to achieve right i want to see the boob is my hair everyday what s the same time table,hate
8,No no,noHate
9,Is awarded naples different time one of the most popular what are the four great news lady rubber shape unipolarism,noHate
10,Distracted and the guy who put the pole on the robber tribe,noHate
11,hour open hair,noHate
12,Take that ryan gosling space,noHate
13,The great news for me and you a my no wife,noHate
14,Eating disorder and so i wa in my life,noHate
15,Analysis of my boob student different size side effect of eating disorder sometimes do boob,hate
16,One is bigger than other one,noHate
17,The same general fare one wa just like a schedule version of the other one is like alec baldwin and stephen baldwin to stevens you know,hate
18,Virtual access point,noHate
19,And i will be soon be arrested for it i had to explain why he wa able to see and hear him not to like to you like bass,hate
20,Young woman,noHate
21,You don t have to the tragic irony of this whole thing is that that s not even because one of the surgeon made a mistake in,hate
22,I know i never get an operation by the airport,noHate
23,And i hate them for the last couple year,noHate
24,I hate them because i thought a shame my whole thing is you know it s up to you are love you so i wa having all the time,noHate
25,Right down to the surgeon in his i can understand this entry make no sense it s all time slip of proton never take right to take a new only broker shoulder had this happen,noHate
26,Mum and i realise that i found myself and my pic itself my life,noHate
